Question ID,Description,Topic,Correct Answer,Options
1827,The tissue which has free surface that faces either a body fluid or the outside environment is called characteristics of the,structural organisation in animals ,Epithelial tissue,"Muscular tissue, Fluid connective tissue, Epithelial tissue, Nervous tissue"
1828,"Epithelial tissue is distinguished from connective tissue, muscular, or nervous tissue by its",structural organisation in animals ,basement membrane,"large extracellular matrix, contractibility, ability to carry action potentials, basement membrane"
1829,The ciliated columnar epithelial cells in humans occur in,structural organisation in animals ,bronchioles and fallopian tubes,"Eustachian tube and stomach lining, bronchioles and fallopian tubes, bile duct and oesophagus, fallopian tubes and urethra"
1830,The squamous epithelium is found in,structural organisation in animals ,air sacs of lungs,"stomach, intestine, trachea, air sacs of lungs"
1831,The kind of epithelium which forms the inner walls of blood vessels is,structural organisation in animals ,squamous epithelium,"cuboidal epithelium, columnar epithelium, ciliated columnar epithelium, squamous epithelium"
1832,Which of the following type of cell junction is not found in animal tissues?,structural organisation in animals ,Plasmodesmata,"Adhering junction, Tight junction, Gap junction, Plasmodesmata"
1833,Which of the following statement is incorrect regarding cuboidal epithelium?,structural organisation in animals ,They are found in the walls of blood vessels and air sacs of lungs.,"It is an epithelial tissue, It is composed of a single layer of cube-like cells., They are found in the walls of blood vessels and air sacs of lungs., Secretion and absorption are the main functions of these tissue."
1834,Which of the following statement(s) is/are correct  regarding compound epithelium?,structural organisation in animals ,All of the above,"It is made of more than one layer of cells and thus has a limited role in secretion and absorption., Their main function is to provide protection against chemical and mechanical stresses., They cover the dry surface of the skin, moist surface of buccal cavity, pharynx, inner lining of ducts of salivary glands and pancreatic ducts., All of the above"
1835,"Ciliated simple columnar epithelium often contains _________,which increase the surface area for secretion and absorption.",structural organisation in animals ,microvilli,"flagella, collagen fibres, microvilli, all of these"
1836,A student was given a sample of two tissues. He observes the tissues under the microscope and draws their figures (1 and 2) as shown below. Identify the tissues (1 and 2).,structural organisation in animals ,1. Columnar cells bearing cilia; 2: Multicellular glandular epithelium,"1: Columnar cells bearing cilia: 2: Unicellular glandular epithelium, 1: Cuboidal cells bearing cilia: 2: Multicellular glandular epithelium, 1: Compound cells bearing cilia; 2: Unicellular glandular epithelium, 1. Columnar cells bearing cilia; 2: Multicellular glandular epithelium"
1837,Which of the following statement(s) regarding cell junctions is/are correct?,structural organisation in animals ,All of the above,"Tight junctions help to stop substances from leaking across a tissue., Adhering junctions perform cementing to keen neighbouring cells together., All of the above, Gap junctions facilitate the cells to communicate With each other by connecting the cytoplasm adjoining cells, for rapid transfer of ions small molecules and sometimes big molecules"
1838,Choose the correctly matched pair,structural organisation in animals ,Tubular parts of nephrons - Cuboidal epithelium,"Inner lining of salivary ducts - Ciliated epithelium, Moist surface of buccal cavity - Glandular epithelium, Tubular parts of nephrons - Cuboidal epithelium, Inner surface of bronchioles - Squamous epithelium"
1839,The function of the gap junction is to:,structural organisation in animals ,"facilitate communication between adjoining cells by connecting the cytoplasm for rapid transfer of ions, small molecules and some large molecules","separate two cells from each other, stop substance from leaking across a tissue, performing cementing to keep neighbouring cells together, facilitate communication between adjoining cells by connecting the cytoplasm for rapid transfer of ions, small molecules and some large molecules"
1840,The only type of cell seen in a tendon is,structural organisation in animals ,fibroblasts,"muscle fibres, reticular cells, collagenous cells, fibroblasts"
1841,Tendons and ligaments are the examples of,structural organisation in animals ,dense regular connective tissue,"areolar connective tissue, adipose tissue, dense regular connective tissue, loose connective tissue"
1842,Which of the following statement is incorrect regarding cuboidal epithelium?,structural organisation in animals ,They are found in the walls of blood vessels and air sacs of lungs,"It is an epithelial tissue., It is Composed of a single layer of cube-like cells, They are found in the walls of blood vessels and air sacs of lungs, Secretion and absorption are the main functions of these tissue"
1843,What are the three basic components of connective tissues ?,structural organisation in animals ,"Cells, protein fibers and ground substance","Ground substance, cells and basement membrane, Cartilage, intercellular matrix and serum, Cells, protein fibers and ground substance, Collagen, elastin and reticular fibers"
1844,The major functions of loose connective tissue include,structural organisation in animals ,All of the above,"occupying spaces between organs and supporting epithelia, supporting and surrounding blood vessels and nerves, cushioning organs, storing lipids and facilitating diffusion, All of the above"
1845,Which one is the characteristic of epithelial tissue?,structural organisation in animals ,The cells will have a rapid rate of cell division.,"Tissues are highly vascularised., These cells never produce glands., The cells will have a rapid rate of cell division., Large intercellular spaces are seen between cells."
1846,What will happen if ligaments are cut or broken?,structural organisation in animals ,Bones will become unfixed.,"No movements at joints., Bones will become fixed, Bones will become unfixed., Bone will move freely at joints."
1847,The supportive skeletal structures in the human external ears and in the nose tip are examples of,structural organisation in animals ,cartilage,"ligament, areolar tissue, bone, cartilage"
1848,Which of the following types of connective tissue is mismatched with its matrix?,structural organisation in animals ,Cartilage - Highly vascular matrix,"Areolar - Loosely packed matrix of protein fibres, Bone - Mineralized matrix, Cartilage - Highly vascular matrix, Blood - Liquid matrix"
1849,The protein present in the matrix of cartilage is,structural organisation in animals ,Chondrin,"Chitin, Chondrin, Ossein, Chondriotin"
1850,The camel's hump is composed of a tissue which provides water when oxidized. It is:,structural organisation in animals ,Adipose tissue,"Skeletal tissue, Areolar tissue, Adipose tissue, Muscular tissue"
1851,The function of the gap junction is to,structural organisation in animals ,"facilitate communication between adjoining cells by connecting the cytoplasm for rapid transfer of ions, small molecules and some large molecules","separate two cells from each other, stop substance from leaking across a tissue., performing cementing to keep neighbouring cells together, facilitate communication between adjoining cells by connecting the cytoplasm for rapid transfer of ions, small molecules and some large molecules"
1852,Choose the correctly matched pair.,structural organisation in animals ,Areolar tissue - Loose connective tissue,"Tendon-Specialized connective tissue, Adipose tissue - Dense connective tissue, Areolar tissue - Loose connective tissue, Cartilage-Loose connective tissue"
1853,"Muscle tissue cells are contractile, which means they",structural organisation in animals ,are specialized in contraction and relaxation,"are responsible for the production and secretion of enzymes., are specialized in contraction and relaxation, help in the movement of involuntary organs only., all of the above"
1854,The fibres of which of the following muscles are fusiform and do not show striations,structural organisation in animals ,Smooth muscles,"Skeletal muscles, Cardiac muscles, Both (a) and (b), Smooth muscles"
1855,Intercalated discs are the communication junctions between the cells of,structural organisation in animals ,cardiac muscles,"cardiac muscles, striped muscles, adipose tissue, nerve and striated muscles"
1856,Smooth muscles are _______.,structural organisation in animals ,"involuntary, spindle shaped, uninucleated, tapering","voluntary, branched, uninucleate, voluntary, multinucleate, cylindrical, involuntary, cylindrical, multinucleate, involuntary, spindle shaped, uninucleated, tapering"
1857,Which of the following statement(s) is/are correct about muscle tissue?,structural organisation in animals ,All of the above,"Each muscle is made of many long, cylindrical fibres arranged in parallel arrays., Muscle fibres contract (shorten) in response to stimulation, then relax (lengthen) and return to their uncontracted state in a coordinated fashion, Muscles play an active role in all movements of the body, All of the above"
1858,Three essential components of most neurons are,structural organisation in animals ,"axon, dendrites and cell body.","simple epithelium, extracellular matrix and nerves., axon, dendrites and cell body., nerve cells, synapse and neuroglia., mylein sheeth, node of Ranvier and Schwann cells"
1859,Neuroglia are,structural organisation in animals ,supporting and non-protecting cells of neural tissue,"excitable cells of neural tissue., supporting and non-protecting cells of neural tissue, two to three times in volume of neural tissue, protective and excitable cells of neural tissue"
1860,Nervous tissue cells that play several supporting roles but do not transmit impulses are called,structural organisation in animals ,glial cells,"glial cells, dendrites, nerve cells, neurons"
1861,Which of the following statements Is not correct regarding neural tissue ?,structural organisation in animals ,"Chondrocytes, the unit of neural system are excitable cells.","it exerts the greatest control over the body's responsiveness to changing conditions., Chondrocytes, the unit of neural system are excitable cells., Neuroglial cells protect and support neurons., When a neuron is suitably stimulated, an electrical disturbance is generated."
1862,The secretions of endocrine glands are released directly,structural organisation in animals ,into the blood stream,"into the skin surface, into the blood stream, into a gland duct, into the brain tissue"
1863,Mast cells are associated with,structural organisation in animals ,areolar connective tissue,"exocrine glands, endocrine glands, areolar connective tissue, neural tissue"
1864,Which of the following is involved in the production of new blood cells?,structural organisation in animals ,Bone marrow,"Adipose cell, Bone marrow, Liver, Matrix"
1865,Which of the following vertebrate tissues would be an excellent source of collagen?,structural organisation in animals ,Tendon,"Liver, Nerve, Muscle, Tendon"
1866,The complexity in organ and organ systems displays certain discernable trend. This discernable trend is known as,structural organisation in animals ,Evolutionary trend,"Evolutionary trend, Morphological trend, Complexity trend, Anatomical trend"
1867,Which of the following statement is correct about anatomy,structural organisation in animals ,Study of morphology of internal organs in the animal,"Study of form or externally visible features, Study of internal as well as external features., Study of morphology of internal organs in the animal, None of the above statements"
1868,General function of gland is to,structural organisation in animals ,produce and secrete specialized compounds to control and maintain different body functions,"protect the body, control the function of epithelial tissues, produce and secrete specialized compounds to control and maintain different body functions, help to maintain blood pressure and nerve actions"
1869,Which one of the following pair of structures distinguish a nerve cell from other types of cell ?,structural organisation in animals ,Cell body and Dendrites,"Vacuoles and Fibres, Flagellum and Medullary sheath, Nucleus and Mitochondria, Cell body and Dendrites"
1870,Frogs are:,structural organisation in animals ,Both (a) and (c),"Ureotelic, Stenothermal, Poikilothermal, Both (a) and (c)"
1871,Frog takes water through which of the following organs?,structural organisation in animals ,Skin,"Eyes, Skin, Mouth, Gills"
1872,Mesorchium in frogs is associated with,structural organisation in animals ,Both (a) & (b),"Testes, Kidney, Brain, Both (a) & (b)"
1873,"In frogs, the cloaca is used to pass",structural organisation in animals ,All of the them,"Sperms, Urine, Fecal matter, All of the them"
1874,"In a frog, if a hole is punched in the floor of its buccal cavity, then the frog will not die as",structural organisation in animals ,pulmonary respiratory occurs,"buccal respiration does not stop, respiration other than lungs will continue, it can store oxygen for future use, pulmonary respiratory occurs"
1875,Identify the incorrect statement about frog.,structural organisation in animals ,There are ten cranial nerves only,"Parathyroid and pineal body are present, Optic lobes are situated in the mid brain, There are ten cranial nerves only, The ventricle opens into the conus arteriousus"
1876,In frog mesorchium is a thin fold of membrane extending between,structural organisation in animals ,kidneys and testes,"two testes, kidneys and testes, two kidneys, liver and kidneys"
1877,Frog's heart is,structural organisation in animals ,myogenic and 3 chambered,"neurogenic and 4 chambered, myogenic and 2 chambered, neurogenic and 3 chambered, myogenic and 3 chambered"
1878,"Vasa efferentia in male frog, enter the kidney and open into",structural organisation in animals ,Bidder's canal,"Bidder's canal, Ureter, Vacuole, Urinogenital duct"
1879,Incorrect options from the following with respect to frog.,structural organisation in animals ,The outer covering of kidney is called mesorchium,"Frogs are devoid of internal ear, Vasa efferentia enters into bidder's canal, A mature female frog can lay 2500 to 3000 ova at a time, The outer covering of kidney is called mesorchium"
1880,The ability to change colour and hide from the enemies in frog is called,structural organisation in animals ,Camouflage,"Ammensalism, Camouflage, Aestivation, Moulting"
1881,Special venous connection between kidney and lower parts of body in a  frog is called,structural organisation in animals ,Renal portal system,"Hepatic portal system, Renal portal system, Atrial hepatic system, Both (a) and (b)"
1882,Through which of the following structure the medulla oblongata passes out and continues into spinal cord ?,structural organisation in animals ,Foramen magnum,"Formenovale, Fossa ovalis, Foramen magnum, None of these"
1883,"The figure given here shows a diagrammatic representation of internal organs of the frog digestive system. Identify A to D and select the correct option. 
 
A, B, C,D",structural organisation in animals ,"Gall bladder, Lung, Fat bodies, Kidney","Gall bladder, Liver, Testis, Rectum, Gall bladder, Lung, Fat bodies, Kidney, Pancreas, Lungs, Testis, Liver, Liver, Pancreas, Fat bodies, Gall bladder"
1884,"In the given diagram of areolar connective tissue, the different cells and parts have been marked by alphabets (A, B, C& D). Choose the answer in which these alphabets correctly match with the parts and",structural organisation in animals ,"A-Macrophage, B-Fibroblast, C-Collagen fibres,  D-Mast cells","A-Adipocyte, B-Collagen fibres, C-Microfilament, D-Mast cells, A-Macrophage, B-Collagen fibres, C-Microfilament, D-Mast cells, A-Macrophage, B-Collagen fibres, C-Microtubule, D-RBC, A-Macrophage, B-Fibroblast, C-Collagen fibres,  D-Mast cells"
1895,Which of the following statements is incorrect for simple epithelium?,structural organisation in animals ,They are vascularized,"They are derived from any of the embryonic germ layers, They are vascularized, The cells have a rapid rate of cell division, Cemented to one another to form a single layer"
1896,The main function of simple cuboidal epithelium is :,structural organisation in animals ,Secretion and absorption,"Diffusion, Secretion and absorption, Protection, Diffusion and protection"
1897,Epithelial cells of the intestine involved in food absorption have on their surface :,structural organisation in animals ,Micro-villi,"Pinocytic vesicles, Phagocytic vesicles, Zymogen granules, Micro-villi"
1898,Brush border epithelium occurs in :,structural organisation in animals ,Small intestine,"Trachea, Stomach, Small intestine, Oesophagus"
1899,"The tissue which has power of division and regeneration, throughout life, is :",structural organisation in animals ,Epithelial tissue,"Epithelial tissue, Muscular tissue, Connective tissue, Nervous tissue"
1900,Gland which is both exocrine and endocrine is :,structural organisation in animals ,Heterocrine glands,"Tubular glands, Saccular glands, Apocrine glands, Heterocrine glands"
1901,"This epithelium is made up of a single thin layer of flattened cells and is involved in diffusion, it is found in:",structural organisation in animals ,Walls of blood vessels,"Walls of blood vessels, Ducts of glands, Tubular parts of nephrons, All of these"
1902,"Exoskeleton (e.g. feathers, nails, horns, hooves) originated from :",structural organisation in animals ,Epithelium tissue,"Connective tissue proper, Epithelium tissue, Skeletal tissue, Vascular tissue"
1903,Trachea consist of which epithelium ?,structural organisation in animals ,Simple ciliated,"Simple columnar, Simple ciliated, Simple cuboidal, Stratified cuboidal"
1904,Characteristic of simple epithelium is :,structural organisation in animals ,They make a definite layer,"They are arranged irregularly, They make a definite layer, Continue to divide and help in organ function, Never divide"
1905,Vesicles of thyroid gland is composed of :,structural organisation in animals ,Simple cuboidal epithelium,"Simple squamous epithelium, Simple cuboidal epithelium, Stratified squamous epithelium, Stratified cuboidal epithelium"
1906,Which of the following is not an endocrine gland ?,structural organisation in animals ,Salivary,"Thyroid, Thymus, Adrenal, Salivary"
1907,Characteristic of epithelial tissues is :,structural organisation in animals ,Cells can undergo rapid divisions,"Never produce glands, Cells can undergo rapid divisions, Abundant vascularisation, Large intercellular spaces"
1908,"Which of the following characteristic is typical for all kinds of compound epithelia ? 
 a. Presence of basement membrane 
 b. Presence of germinativum layer of columnar cells
 c. Multilayer of cells 
 d. Basal layer of squamous cells",structural organisation in animals ,c only,"b & c, c only, a, b & c, a & c"
1909,Select the correct matching :,structural organisation in animals ,Columnar epithelium - Stomach,"Cuboidal epithelium - Alveolar wall, Columnar epithelium - Stomach, Ciliated epithelium - Intestine, Squamous epithelium - Germinal epithelium"
1910,"Assertion (A) : Gap junctions connect the cytoplasm of adjoining cells.
 Reason (R) : Gap junctions facilitate the cells to communicate with each other",structural organisation in animals ,Both A and R are true but R is not correct explanation of A,"Both A and R are true and R is the correct explanation of A., Both A and R are true but R is not correct explanation of A, A is true but R is false, A and R are false"
1911,The major protein of the connective tissues is :,structural organisation in animals ,Collagen,"Keratin, Collagen, Melanin, Myosin"
1912,Inter vertebral discs are composed of :,structural organisation in animals ,White fibrous cartilage,"Hyaline cartilage, Elastic cartilage, White fibrous cartilage, Calcified cartilage"
1913,Haversian canal contain :,structural organisation in animals ,Blood vessels and nerves,"Blood vessels and nerves, Blood vessels only, Lymphatic only, Connective tissue only"
1914,Fibroblast secretes :,structural organisation in animals ,Both A and B,"Matrix, Fibres, Both A and B, Cells"
1915,Mast cell secrete :,structural organisation in animals ,All of the above,"Anticoagulant : Heparin, Vasodilator : Histamine, Vasoconstrictor : Serotonin, All of the above"
1916,Epiglottis is composed of :,structural organisation in animals ,Elastic cartilage,"Hyaline cartilage, White fibro cartilage, Calcified cartilage, Elastic cartilage"
1917,All the following cells produces collagen except :,structural organisation in animals ,Mast cells,"Osteoblast, Chondroblast, Fibro blast, Mast cells"
1918,Matrix of cartilage is produced by :,structural organisation in animals ,Chondroblasts,"Chondrocytes, Chondroblasts, Osteocytes, Histiocytes"
1919,Which of following lacks blood supply ?,structural organisation in animals ,Cartilage,"Bone, Cartilage, Connective tissue, All"
1920,Sprain of body is due to pulling of :,structural organisation in animals ,Ligaments,"Muscles, Ligaments, Tendon, Nerves"
1921,Protein present in cartilage is :,structural organisation in animals ,Chondrin,"Fibroin, Chondrin, Ossein, Casein"
1922,Ligament connects :,structural organisation in animals ,Bone to bone,"Muscle to skin, Bone to bone, Muscle to muscle, Muscle to bone"
1923,Scavanger cell of connective tissue proper is called as :,structural organisation in animals ,Macrophages,"Fibroblast cell, Mast cell, Plasma cell, Macrophages"
1924,Cartilage is present in :,structural organisation in animals ,Between adjacent bones of vertebral column and limbs,"Between adjacent bones of vertebral column and limbs, In middle of the long bone, Bone marrow cavity, All of the above"
1925,Regeneration of cartilage can occur from its :,structural organisation in animals ,Perichondrium,"Matrix, Plasma, Perichondrium, A piece without perichondrium"
1926,What will happen if ligaments are cut or broken ?,structural organisation in animals ,Bones will become unfixed,"Bones will move freely at joints, No movement at joint, Bones will become unfixed, Bones will become fixed"
1927,The central shaft of a long bone is known as :,structural organisation in animals ,Diaphysis,"Diaphysis, Epiphysis, Metaphysis, Zygapophysis"
1928,Haversian system is a diagnostic feature of :,structural organisation in animals ,Mammalian bones,"Avian bones, All animals, Mammalian bones, Reptilian bones"
1929,Cartilage is formed by :,structural organisation in animals ,Chondroblasts,"Osteoblasts, Fibroblasts, Chondroclasts, Chondroblasts"
1930,The membrane that covers cartilage is known as :,structural organisation in animals ,Perichondrium,"Periosteum, Perichondrium, Perineurium, Pericardium"
1931,External ear (pinna) is a flexible structure composed of :,structural organisation in animals ,Cartilage,"Bone, Cartilage, Tendon, Ligament"
1932,Formation of cartilage is known as :,structural organisation in animals ,Chondrogenesis,"Diapedesis, Chondrogenesis, Haemopoiesis, Ossification"
1933,Role of bone marrow in mammals is to :,structural organisation in animals ,Act as haemopoietic tissue,"Assist kidneys, Act as haemopoietic tissue, Assist liver, Control blood pressure"
1934,Hyaline cartilage forms :,structural organisation in animals ,Tracheal rings,"Tracheal rings, Pubic symphysis, Epiglottis, External ear pinna"
1935,Bone forming cells are known as :,structural organisation in animals ,Osteoblasts,"Chondroclasts, Osteoblasts, Chondroblasts, Osteoclasts"
1936,Cardiac muscle fibres are :,structural organisation in animals ,Striated and involuntary,"Striated and involuntary, Striated and voluntary, Non–striated and involuntary, Non–striated and voluntary"
1937,"Which one of the following muscles, gets fatigued very quickly?",structural organisation in animals ,Skeletal muscle,"Skeletal muscle, Smooth muscle, Cardiac muscle, All of the above"
1938,Involuntary muscles are :,structural organisation in animals ,Both (B) and (C),"Under the control of will, Not under the control of animal's will, Controlled by autonomic nervous system, Both (B) and (C)"
1939,Unstriped muscles are also known as :,structural organisation in animals ,All of these,"Visceral muscles, Smooth muscles, Involuntary muscles, All of these"
1940,Nodes of Ranvier are found in :,structural organisation in animals ,Axon,"Cyton, Dendrons, Axon, Astrocyte"
1941,Which cell-organelle is absent in neurons ?,structural organisation in animals ,Centriole,"Mitochondria, Ribosome, Centriole, Nucleus"
1942,Select the incorrect statement about nerve fibres :,structural organisation in animals ,Myelin sheath is continuous at the Node of Ranvier,"The dendrite carries impulse towards the cyton, Neurons and muscle fibres are excitable cells, Nissl's granules are absent in axon, Myelin sheath is continuous at the Node of Ranvier"
1943,The nerve cell can be distinguished from other cells of the body by the presence of :,structural organisation in animals ,Axon & dendrites,"Nucleus, Plasma membrane, Mitochondria, Axon & dendrites"
1944,The functional connection between two neurons is called:,structural organisation in animals ,Synapse,"Synapse, Synapsis, Chiasma, Chiasmata"
1945,Which of the following is a non–excitable cell ?,structural organisation in animals ,Astrocyte,"Neuron, Smooth muscle cell, Astrocyte, Skeletal muscle cell"
