Question ID,Description,Topic,Correct Answer,Options
1946,In non–myelinated nerve fibre of PNS :,structural organisation in animals ,Myelin sheath is absent,"Myelin sheath is absent, Schwann cell is absent, Both (A) & (B) are absent, Axon is absent"
1947,Which of the following cell can't be grown by tissue culture ?,structural organisation in animals ,Neuron,"Epithelial cell, Fibroblast, Monocyte, Neuron"
1948,Which one of the following types of cell is involved in making of the inner walls of blood vessels?,structural organisation in animals ,Squamous epithelium,"Cuboidal epithelium, Columnar epithelium, Squamous epithelium, Stratified epithelium"
1949,To which one of the following categories does adipose tissue belong?,structural organisation in animals ,Connective,"Epithelial, Connective, Muscular, Neural"
1950,Which one of the following is not a connective tissue?,structural organisation in animals ,Muscles,"Bone, Cartilage, Blood, Muscles"
1951,"Match the following and choose the correct option
  Column I     Column II
 A. Adipose tissue   i. Nose
 B. Stratified epithelium   ii. Blood
 C. Hyaline cartilage   iii. Skin
 D. Fluid connective tissue  iv. Fat storage
 Options:",structural organisation in animals ,"A-iv, B-iii, C-i, D-ii","A-i, B-ii, C-iii, D-iv, A-iv, B-iii, C-i, D-ii, A-iii, B-i, C-iv, D-ii, A-ii, B-i, C-iv, D-iii"
1952,A muscle fibre tapers at ends and does not show striations is :,structural organisation in animals ,Smooth muscle fibre,"Smooth muscle fibre, Skeletal muscle fibre, Cardiac muscle fibre, Striated muscle fibre"
1953,Structural organisation in animals attains different levels as cell–organ–organ system. What is missing in this chain ?,structural organisation in animals ,Tissue,"Molecule, Tissue, Atom, Organism"
1954,Which is not a common property of a muscle fibre and a nerve fibre ?,structural organisation in animals ,Contracitility,"Excitability, Conductivity, Both (1) & (2), Contracitility"
1955,Mark the odd one :,structural organisation in animals ,Neuron,"Areolar tissue, Blood, Neuron, Tendon"
1956,Mark the odd one :,structural organisation in animals ,Cartilage,"RBC, WBC, Platelets, Cartilage"
1957,Mark the odd one :,structural organisation in animals ,Ligament,"Exocrine, Endocrine, Salivary gland, Ligament"
1958,Mark the incorrect match :,structural organisation in animals ,Fibroblasts   –  Blood,"Compound epithelium  – Skin, Osteocytes –  Bone, Fibroblasts   –  Blood, Chondrocytes –  Cartilage"
1959,Many years old 'mummies' still have their arteries intact due to well preserved :,structural organisation in animals ,Elastic fibres,"Collagen fibres, Elastic fibres, Reticulin fibres, Tunica intima"
1960,"Bone is a solid, rigid connective tissue. If the bone is put into KOH, then the bone will :",structural organisation in animals ,Remain unchanged,"Become decalcified, Become soft, Become flexible, Remain unchanged"
1961,Neurons which connect the central nervous system to the receptors are :,structural organisation in animals ,Sensory neurons,"Sensory neurons, Motor neurons, Interneurons, Both (B) & (C)"
1962,Which type of neuron dominates in the CNS ?,structural organisation in animals ,Interneurons,"Sensory, Motor, Efferent, Interneurons"
1963,Mark the connective tissue which is without fibres and matrix is not secreted by its cellular component :,structural organisation in animals ,Blood,"Areolar tissue, Adipose tissue, Blood, Cartilage"
1964,The percentage of inorganic and organic parts in the matrix of a bone is,structural organisation in animals ,"70% inorganic, 30% organic","40% inorganic, 60% organic, 62% inorganic, 38% organic, 70% inorganic, 30% organic, 85% inorganic, 15% organic"
